{
  "schema_version": "1.0.0",
  "approval_id": "OWNER-APPROVAL-R2-SC-GOV-INSTALL-001-CANDIDATE-7305A9DE-R1",
  "change_set_id": "CS-R2-SC-GOV-INSTALL-001",
  "base_commit": "e90a717d3863e4fb0e5e1a0fcc01661f24d2157d",
  "base_tree": "7a1ce74ad0b82c7c288b94c47c966028e916137d",
  "base_canon_hash": "d7ceea75615b57970f3b9712b73ed4c9f65a9c4406c877e9013470cb53a6141a",
  "candidate_commit": "7305a9decacf4a6361692fe9359a1afa96801722",
  "candidate_tree": "e5969a0464a7e73d7d1da546da83afea9015fdba",
  "proposed_canon_hash": "d7ceea75615b57970f3b9712b73ed4c9f65a9c4406c877e9013470cb53a6141a",
  "implementation_merkle_root": "5b9e417209beab3dc88ed305a79b8945512d4c0e842397e5494885ac4dd3a23e",
  "receipt_candidate_payload_hash": "5d348a937de063ba66922258c54a8bfc4a83fc3539d559916afb7f6a9bb2fb9e",
  "approval": "OWNER_HASH_APPROVED_FOR_INDEPENDENT_ACCEPT",
  "single_use": true,
  "transferable": false,
  "revoked": false,
  "consumption_count": 1,
  "consumption_event": "R2-SC-GOV-INSTALL-001-ACCEPT-001",
  "consumption_result": "PASS_FIXED_CANDIDATE_ACCEPTED",
  "accepted_candidate_commit": "7305a9decacf4a6361692fe9359a1afa96801722",
  "accepted_candidate_tree": "e5969a0464a7e73d7d1da546da83afea9015fdba",
  "accept_route_digest": "706cd9195ef483ddc47a76774780059d46b24b813e948ab28b532a613e9f1cd6",
  "owner_approval_transport_sha256": "87bc960d75b1fd38106ee4e545d4960c0e0d8751141ccfcaa126b30142236ed9",
  "consumed": true
}
